<!--
  ~ Copyright 2009 Igor Azarnyi, Denys Pavlov
  ~
  ~    Licensed under the Apache License, Version 2.0 (the "License");
  ~    you may not use this file except in compliance with the License.
  ~    You may obtain a copy of the License at
  ~
  ~        http://www.apache.org/licenses/LICENSE-2.0
  ~
  ~    Unless required by applicable law or agreed to in writing, software
  ~    distributed under the License is distributed on an "AS IS" BASIS,
  ~    WITHOUT WARRANTIES OR CONDITIONS OF ANY KIND, either express or implied.
  ~    See the License for the specific language governing permissions and
  ~    limitations under the License.
  -->

<import-descriptor xmlns:xsi="http://www.w3.org/2001/XMLSchema-instance"
                   xsi:noNamespaceSchemaLocation="http://www.yes-cart.org/xstream/import-descriptor-1.0.0.xsd">

    <entity-type>org.yes.cart.domain.entity.CarrierSla</entity-type>

    <import-directory></import-directory>

    <import-file-descriptor>
        <file-encoding>UTF-8</file-encoding>
        <file-name-mask>carrierslanames(.*).csv(.*)</file-name-mask>
        <ignore-first-line>true</ignore-first-line>
        <column-delimiter>;</column-delimiter>
        <text-qualifier>&quot;</text-qualifier>
    </import-file-descriptor>

    <select-sql>select c from CarrierSlaEntity c where c.name = {name} and c.carrier.name = {carrier}</select-sql>

    <import-columns>

        <column-descriptor>
            <column-index>0</column-index>
            <field-type>FIELD</field-type>
            <name>name</name>
            <value-regex>(.{0,255})(.*)</value-regex>
            <value-regex-group>1</value-regex-group>
        </column-descriptor>

        <column-descriptor>
            <column-index>1</column-index>
            <field-type>FIELD</field-type>
            <name>displayName</name>
            <language>en</language>
            <value-regex>(.{0,255})(.*)</value-regex>
            <value-regex-group>1</value-regex-group>
        </column-descriptor>

        <column-descriptor>
            <column-index>2</column-index>
            <field-type>FIELD</field-type>
            <name>displayName</name>
            <language>ru</language>
            <value-regex>(.{0,255})(.*)</value-regex>
            <value-regex-group>1</value-regex-group>
        </column-descriptor>

        <column-descriptor>
            <column-index>3</column-index>
            <field-type>FIELD</field-type>
            <name>description</name>
            <value-regex>(.{0,4000})(.*)</value-regex>
            <value-regex-group>1</value-regex-group>
        </column-descriptor>

        <column-descriptor>
            <column-index>6</column-index>
            <field-type>FIELD</field-type>
            <data-type>DECIMAL</data-type>
            <name>price</name>
        </column-descriptor>

        <column-descriptor>
            <column-index>-1</column-index>
            <field-type>FIELD</field-type>
            <data-type>DECIMAL</data-type>
            <name>percent</name>
            <value-constant>0.00</value-constant>
        </column-descriptor>

        <column-descriptor>
            <column-index>7</column-index>
            <field-type>FIELD</field-type>
            <name>currency</name>
        </column-descriptor>

        <column-descriptor>
            <column-index>8</column-index>
            <field-type>FK_FIELD</field-type>
            <entity-type>org.yes.cart.domain.entity.Carrier</entity-type>
            <name>carrier</name>
            <value-regex>(.{0,255})(.*)</value-regex>
            <value-regex-group>1</value-regex-group>
            <lookup-query>select c from CarrierEntity c where c.name = {carrier}</lookup-query>
        </column-descriptor>

        <column-descriptor>
            <column-index>9</column-index>
            <field-type>FIELD</field-type>
            <name>slaType</name>
            <value-regex>(.{1,1})(.*)</value-regex>
            <value-regex-group>1</value-regex-group>
        </column-descriptor>

        <column-descriptor>
            <column-index>10</column-index>
            <field-type>FIELD</field-type>
            <data-type>INT</data-type>
            <name>maxDays</name>
        </column-descriptor>

    </import-columns>
</import-descriptor>