<!--
  ~ Copyright 2009 Igor Azarnyi, Denys Pavlov
  ~
  ~    Licensed under the Apache License, Version 2.0 (the "License");
  ~    you may not use this file except in compliance with the License.
  ~    You may obtain a copy of the License at
  ~
  ~        http://www.apache.org/licenses/LICENSE-2.0
  ~
  ~    Unless required by applicable law or agreed to in writing, software
  ~    distributed under the License is distributed on an "AS IS" BASIS,
  ~    WITHOUT WARRANTIES OR CONDITIONS OF ANY KIND, either express or implied.
  ~    See the License for the specific language governing permissions and
  ~    limitations under the License.
  -->

<import-descriptor xmlns:xsi="http://www.w3.org/2001/XMLSchema-instance"
                   xsi:noNamespaceSchemaLocation="http://www.yes-cart.org/xstream/import-descriptor-1.0.0.xsd">

    <entity-type>org.yes.cart.domain.entity.ShopCategory</entity-type>

    <import-directory>src/test/resources/import</import-directory>

    <import-file-descriptor>
        <file-encoding>UTF-8</file-encoding>
        <file-name-mask>categorynames.csv</file-name-mask>
        <ignore-first-line>true</ignore-first-line>
        <column-delimiter>;</column-delimiter>
        <text-qualifier>&quot;</text-qualifier>
    </import-file-descriptor>

    <select-sql>select p from ShopCategoryEntity p where p.category.guid = {category} and p.shop.code = 'SHOIP1'</select-sql>

    <import-columns>

        <column-descriptor>
            <column-index>-1</column-index>
            <field-type>FIELD</field-type>
            <name>guid</name>
            <value-regex>(.{0,255})(.*)</value-regex>
            <value-regex-group>1</value-regex-group>
        </column-descriptor>

        <!-- Category -->
        <column-descriptor>
            <column-index>1</column-index>
            <field-type>FK_FIELD</field-type>
            <entity-type>org.yes.cart.domain.entity.Category</entity-type>
            <name>category</name>
            <value-regex>(.{0,255})(.*)</value-regex>
            <value-regex-group>1</value-regex-group>
            <lookup-query>select c from CategoryEntity c where c.guid = {category}</lookup-query>
        </column-descriptor>

        <!-- Shop -->
        <column-descriptor>
            <column-index>-1</column-index>
            <field-type>FK_FIELD</field-type>
            <entity-type>org.yes.cart.domain.entity.Shop</entity-type>
            <name>shop</name>
            <lookup-query>select a from ShopEntity a where a.code = 'SHOIP1'</lookup-query>
        </column-descriptor>


    </import-columns>
</import-descriptor>