<!--
  ~ Copyright 2009 Igor Azarnyi, Denys Pavlov
  ~
  ~    Licensed under the Apache License, Version 2.0 (the "License");
  ~    you may not use this file except in compliance with the License.
  ~    You may obtain a copy of the License at
  ~
  ~        http://www.apache.org/licenses/LICENSE-2.0
  ~
  ~    Unless required by applicable law or agreed to in writing, software
  ~    distributed under the License is distributed on an "AS IS" BASIS,
  ~    WITHOUT WARRANTIES OR CONDITIONS OF ANY KIND, either express or implied.
  ~    See the License for the specific language governing permissions and
  ~    limitations under the License.
  -->

<import-descriptor xmlns:xsi="http://www.w3.org/2001/XMLSchema-instance"
                   xsi:noNamespaceSchemaLocation="http://www.yes-cart.org/xstream/import-descriptor-1.0.0.xsd">

    <entity-type>org.yes.cart.domain.entity.ProductType</entity-type>

    <import-directory>src/test/resources/import</import-directory>

    <import-file-descriptor>
        <file-encoding>UTF-8</file-encoding>
        <file-name-mask>producttypenames.csv</file-name-mask>
        <ignore-first-line>true</ignore-first-line>
        <column-delimiter>;</column-delimiter>
        <text-qualifier>&quot;</text-qualifier>
    </import-file-descriptor>

    <select-sql>select b from ProductTypeEntity b where b.name = {name}</select-sql>

    <import-columns>
        
        <column-descriptor>
            <column-index>0</column-index>
            <field-type>FIELD</field-type>
            <name>name</name>
            <value-regex>(.{0,255})(.*)</value-regex>
            <value-regex-group>1</value-regex-group>
        </column-descriptor>

        <column-descriptor>
            <column-index>3</column-index>
            <field-type>FIELD</field-type>
            <name>description</name>
            <value-regex>(.{0,255})(.*)</value-regex>
            <value-regex-group>1</value-regex-group>
        </column-descriptor>

    </import-columns>
</import-descriptor>